Symbol,Name,Last Sale,Net Change,% Change,Market Cap,Country,IPO Year,Volume,Sector,Industry
CRDF,Cardiff Oncology Inc. Common Stock,$1.8665,0.0465,2.555%,83389936.00,United States,,15579,Health Care,Biotechnology: Biological Products (No Diagnostic Substances)
CRDL,Cardiol Therapeutics Inc. Class A Common Shares,$1.90,0.05,2.703%,123716497.00,Canada,,61246,Health Care,Biotechnology: Biological Products (No Diagnostic Substances)
CRDO,Credo Technology Group Holding Ltd Ordinary Shares,$22.33,0.16,0.722%,3364223196.00,United States,2022,365805,Technology,Semiconductors
CREG,Smart Powerr Corp. Common Stock,$1.74,0.00,0.00%,13856393.00,China,,1440,Consumer Discretionary,Business Services
CRESW,Cresud S.A.C.I.F. y A. Warrant,$0.50,0.00,0.00%,299651320.00,Argentina,,1925,Finance,Real Estate
CRESY,Cresud S.A.C.I.F. y A. American Depositary Shares,$7.93,0.16,2.059%,475246994.00,Argentina,1997,8072,Finance,Real Estate
CREV,Carbon Revolution Public Limited Ordinary Shares,$9.00,-0.60,-6.25%,16876656.00,Ireland,,1487,,
CREVW,Carbon Revolution Public Limited Company Warrant,$0.0649,-0.0031,-4.559%,121699.00,Ireland,,25334,,
CREX,Creative Realities Inc. Common Stock,$4.185,0.085,2.073%,43561778.00,United States,,3703,Technology,EDP Services
CRGO,Freightos Limited Ordinary shares,$2.65,-0.29,-9.864%,125716000.00,Israel,,21218,Finance,Blank Checks
CRGX,CARGO Therapeutics Inc. Common Stock,$24.84,-0.21,-0.838%,1023535727.00,United States,2023,39464,,
CRIS,Curis Inc. Common Stock,$9.77,0.00,0.00%,57585210.00,United States,,269,Health Care,Biotechnology: Biological Products (No Diagnostic Substances)
CRKN,Crown Electrokinetics Corp. Common Stock,$0.10,0.0001,0.10%,1263656.00,United States,,92895,Technology,Industrial Machinery/Components
CRMD,CorMedix Inc. Common Stock,$3.6002,0.0602,1.701%,197334314.00,United States,,38108,Health Care,Biotechnology: Pharmaceutical Preparations
CRML,Critical Metals Corp. Ordinary Shares,$13.03,-2.47,-15.935%,0.00,British Virgin Islands,,1746,,
CRMLW,Critical Metals Corp. Warrants,$0.13,0.0114,9.612%,0.00,British Virgin Islands,,772,,
CRMT,America's Car-Mart Inc Common Stock,$68.625,1.745,2.609%,438708508.00,United States,,2002,Consumer Discretionary,Other Specialty Stores
CRNC,Cerence Inc. Common Stock,$15.18,0.55,3.759%,632620990.00,United States,,24504,Technology,EDP Services
CRNT,Ceragon Networks Ltd. Ordinary Shares,$2.99,0.05,1.701%,252236400.00,Israel,,85173,Technology,Radio And Television Broadcasting And Communications Equipment
CRNX,Crinetics Pharmaceuticals Inc. Common Stock,$45.05,2.29,5.355%,3009306528.00,United States,2018,97098,Health Care,Biotechnology: Pharmaceutical Preparations
CRON,Cronos Group Inc. Common Share,$2.025,-0.235,-10.398%,771754967.00,Canada,,971253,Health Care, Medicinal Chemicals and Botanical Products 
CROX,Crocs Inc. Common Stock,$125.20,1.94,1.574%,7574415956.00,United States,2006,76633,Consumer Discretionary,Shoe Manufacturing
CRSP,CRISPR Therapeutics AG Common Shares,$87.18,-0.50,-0.57%,6998457321.00,Switzerland,2016,239245,Health Care,Biotechnology: Biological Products (No Diagnostic Substances)
CRSR,Corsair Gaming Inc. Common Stock,$13.046,0.256,2.002%,1347732202.00,United States,2020,14760,Technology,Computer Manufacturing
CRTO,Criteo S.A. American Depositary Shares,$32.59,0.11,0.339%,1799848451.00,France,2013,17317,Consumer Discretionary,Advertising
CRUS,Cirrus Logic Inc. Common Stock,$90.64,0.81,0.902%,4888666950.00,United States,1989,14221,Technology,Semiconductors
CRVL,CorVel Corp. Common Stock,$247.90,0.16,0.065%,4237671268.00,United States,,1423,Finance,Specialty Insurers
CRVO,CervoMed Inc. Common Stock,$12.99,0.33,2.607%,73712015.00,United States,,1221,Health Care,Biotechnology: Pharmaceutical Preparations
CRVS,Corvus Pharmaceuticals Inc. Common Stock,$2.31,0.01,0.435%,113279124.00,United States,2016,17038,Health Care,Biotechnology: Pharmaceutical Preparations
CRWD,CrowdStrike Holdings Inc. Class A Common Stock,$328.175,7.235,2.254%,78809522365.00,United States,2019,434309,Technology,EDP Services
CRWS,Crown Crafts Inc Common Stock,$5.4355,0.00,0.00%,55663428.00,United States,,108,Consumer Discretionary,Textiles
CSBR,Champions Oncology Inc. Common Stock,$5.90,0.00,0.00%,80203225.00,United States,,36,Health Care,Biotechnology: Biological Products (No Diagnostic Substances)
CSCO,Cisco Systems Inc. Common Stock (DE),$48.27,0.21,0.437%,195454260352.00,United States,1990,1256288,Telecommunications,Computer Communications Equipment
CSGP,CoStar Group Inc. Common Stock,$86.665,0.315,0.365%,35394793804.00,United States,1998,185297,Finance,Real Estate
CSGS,CSG Systems International Inc. Common Stock,$55.22,0.65,1.191%,1638438418.00,United States,1996,7671,Technology,EDP Services
CSIQ,Canadian Solar Inc. Common Shares (ON),$21.83,1.00,4.801%,1411091200.00,Canada,2006,239829,Technology,Semiconductors
CSLM,CSLM Acquisition Corp. Class A Ordinary Share,$11.00,-0.0107,-0.097%,0.00,United States,2022,1651,Finance,Blank Checks
CSLMR,CSLM Acquisition Corp. Right,$0.151,-0.0001,-0.066%,0.00,United States,2022,700,Finance,Blank Checks
CSLMW,CSLM Acquisition Corp. Warrant,$0.10,0.011,12.36%,0.00,United States,2022,52400,Finance,Blank Checks
CSLR,Complete Solaria Inc. Common Stock,$1.105,0.055,5.238%,47710118.00,United States,,2418,Technology,Semiconductors
CSLRW,Complete Solaria Inc. Warrants,$0.03,0.00,0.00%,1295297.00,United States,,1,Finance,Blank Checks
CSPI,CSP Inc. Common Stock,$47.27,1.63,3.571%,229588027.00,United States,1982,18695,Technology,EDP Services
CSQ,Calamos Strategic Total Return Common Stock,$15.92,0.08,0.505%,2529490942.00,United States,2004,19492,Finance,Finance Companies
CSSE,Chicken Soup for the Soul Entertainment Inc. Class A Common Stock,$0.1999,0.0057,2.935%,6439941.00,United States,2017,8649,Consumer Discretionary,Movies/Entertainment
CSSEL,Chicken Soup for the Soul Entertainment Inc. Warrant,$0.0087,0.0007,8.75%,280278.00,United States,,20519,Consumer Discretionary,Movies/Entertainment
CSSEN,Chicken Soup for the Soul Entertainment Inc. 9.50% Notes due 2025,$3.80,0.04,1.064%,122420089.00,United States,,270,Consumer Discretionary,Movies/Entertainment
CSSEP,Chicken Soup for the Soul Entertainment Inc. 9.75% Series A Cumulative Redeemable Perpetual Preferred Stock,$1.09,0.03,2.83%,35115236.00,United States,,276,Consumer Discretionary,Movies/Entertainment
CSTE,Caesarstone Ltd. Ordinary Shares,$4.45,0.04,0.907%,153569500.00,Israel,2012,599,Industrials,Building Materials
CSTL,Castle Biosciences Inc. Common Stock,$23.05,-1.34,-5.494%,620288131.00,United States,2019,96805,Health Care,Medical Specialities
CSTR,CapStar Financial Holdings Inc. Common Stock,$18.90,0.46,2.495%,391456214.00,United States,2016,3048,Finance,Major Banks
CSWC,Capital Southwest Corporation Common Stock,$23.94,0.15,0.631%,1028968468.00,United States,,27658,Consumer Discretionary,Textiles
CSWCZ,Capital Southwest Corporation 7.75% Notes due 2028,$25.90,0.0126,0.049%,1113211500.00,United States,,7340,Finance,Finance Companies
CSWI,CSW Industrials Inc. Common Stock,$228.01,1.24,0.547%,3541558941.00,United States,,2214,Industrials,Home Furnishings
CSX,CSX Corporation Common Stock,$38.05,0.37,0.982%,74545061713.00,United States,,572145,Industrials,Railroads
CTAS,Cintas Corporation Common Stock,$629.96,-0.76,-0.12%,63859949193.00,United States,1983,16365,Consumer Discretionary,Business Services
CTBI,Community Trust Bancorp Inc. Common Stock,$40.4752,1.2452,3.174%,728547124.00,United States,,2607,Finance,Major Banks
CTCX,Carmell Corporation Common Stock,$3.205,-0.045,-1.385%,73976663.00,United States,2021,3187,Health Care,Medical/Dental Instruments
CTCXW,Carmell Corporation Warrant,$0.25,0.05,25.00%,5770411.00,United States,2021,17322,Health Care,Medical/Dental Instruments
CTHR,Charles & Colvard Ltd Common Stock,$0.4161,-0.0015,-0.359%,12626536.00,United States,1997,4093,Consumer Discretionary,Consumer Specialties
CTKB,Cytek Biosciences Inc. Common Stock,$8.345,-0.395,-4.519%,1131157690.00,United States,2021,120846,Health Care,Biotechnology: Electromedical & Electrotherapeutic Apparatus
CTLP,Cantaloupe Inc. Common Stock,$6.57,0.17,2.656%,478276441.00,United States,,27315,Technology,EDP Services
CTMX,CytomX Therapeutics Inc. Common Stock,$2.4503,-0.0897,-3.531%,164142911.00,United States,2015,426277,Health Care,Biotechnology: Pharmaceutical Preparations
CTNT,Cheetah Net Supply Chain Service Inc. Class A Common Stock,$2.2489,0.0339,1.53%,40291292.00,United States,2023,1616,,
CTRM,Castor Maritime Inc. Common Shares,$0.447,-0.0018,-0.401%,42290670.00,Cyprus,,55745,Consumer Discretionary,Marine Transportation
CTRN,Citi Trends Inc. Common Stock,$29.4394,0.3394,1.166%,251540390.00,United States,2005,34807,Consumer Discretionary,Clothing/Shoe/Accessory Stores
CTSH,Cognizant Technology Solutions Corporation Class A Common Stock,$79.515,1.035,1.319%,39585909174.00,United States,1998,213119,Technology,EDP Services
CTSO,Cytosorbents Corporation Common Stock,$0.9666,-0.0034,-0.351%,42954263.00,United States,,7863,Health Care,Medical/Dental Instruments
CTXR,Citius Pharmaceuticals Inc. Common Stock,$0.82,0.0342,4.352%,130457720.00,United States,,74391,Health Care,Biotechnology: Pharmaceutical Preparations
CUBA,Herzfeld Caribbean Basin Fund Inc. (The) Common Stock,$2.6288,0.0087,0.332%,0.00,United States,,8970,Finance,Investment Managers
CUE,Cue Biopharma Inc. Common Stock,$2.13,0.01,0.472%,96112589.00,United States,2018,17613,Health Care,Biotechnology: Pharmaceutical Preparations
CULL,Cullman Bancorp Inc. Common Stock,$10.6956,0.00,0.00%,77614343.00,United States,2021,9,Finance,Savings Institutions
CURI,CuriosityStream Inc. Class A Common Stock,$0.5199,0.0223,4.482%,27594187.00,United States,2020,22362,Consumer Discretionary,Movies/Entertainment
CURIW,CuriosityStream Inc. Warrant,$0.0146,0.0021,16.80%,774909.00,United States,2020,2400,Consumer Discretionary,Movies/Entertainment
CUTR,Cutera Inc. Common Stock,$2.14,0.17,8.629%,42679893.00,United States,2004,226730,Health Care,Biotechnology: Electromedical & Electrotherapeutic Apparatus
CVAC,CureVac N.V. Ordinary Shares,$3.47,-0.04,-1.14%,776730352.00,Germany,2020,44835,Health Care,Biotechnology: Pharmaceutical Preparations
CVBF,CVB Financial Corporation Common Stock,$17.27,0.51,3.043%,2406365429.00,United States,,42284,Finance,Major Banks
CVCO,Cavco Industries Inc. Common Stock When Issued,$376.3088,10.8088,2.957%,3140905804.00,United States,,1556,Consumer Discretionary,Homebuilding
CVCY,Central Valley Community Bancorp Common Stock,$18.63,0.49,2.701%,220111270.00,United States,,1317,Finance,Major Banks
CVGI,Commercial Vehicle Group Inc. Common Stock,$6.57,0.14,2.177%,221455450.00,United States,2004,2714,Consumer Discretionary,Auto Parts:O.E.M.
CVGW,Calavo Growers Inc. Common Stock,$29.26,0.80,2.811%,520787621.00,United States,,5440,Consumer Discretionary,Specialty Foods
CVII,Churchill Capital Corp VII Class A Common Stock,$10.62,0.00,0.00%,0.00,United States,,1,Finance,Blank Checks
CVIIU,Churchill Capital Corp VII Units,$10.60,1.13,11.932%,,United States,,810,Finance,Blank Checks
CVIIW,Churchill Capital Corp VII Warrants,$0.37,-0.02,-5.128%,,United States,,9253,Finance,Blank Checks
CVKD,Cadrenal Therapeutics Inc. Common Stock,$0.72,0.046,6.825%,9376383.00,United States,2023,50860,Health Care, Medicinal Chemicals and Botanical Products 
CVLG,Covenant Logistics Group Inc. Class A Common Stock,$49.40,0.23,0.468%,639568709.00,United States,,2951,Industrials,Trucking Freight/Courier Services
CVLT,Commvault Systems Inc. Common Stock,$95.565,0.325,0.341%,4172522811.00,United States,2006,17624,Technology,Computer Software: Prepackaged Software
CVLY,Codorus Valley Bancorp Inc Common Stock,$23.06,0.64,2.855%,221632197.00,United States,,614,Finance,Savings Institutions
CVRX,CVRx Inc. Common Stock,$20.25,0.27,1.351%,423786512.00,United States,2021,13163,Health Care,Biotechnology: Electromedical & Electrotherapeutic Apparatus
CVV,CVD Equipment Corporation Common Stock,$4.71,-0.2215,-4.492%,32143447.00,United States,,757,Technology,Industrial Machinery/Components
CWBC,Community West Bancshares Common Stock,$14.60,0.27,1.884%,129214555.00,United States,,115,Finance,Major Banks
CWCO,Consolidated Water Co. Ltd. Ordinary Shares,$29.99,0.87,2.988%,472266445.00,Cayman Islands,,12463,Utilities,Water Supply
CWD,CaliberCos Inc. Class A Common Stock,$1.19,0.05,4.386%,25322656.00,United States,2023,1714,Finance,Real Estate
CWST,Casella Waste Systems Inc. Class A Common Stock,$90.09,-0.16,-0.177%,5224812163.00,United States,1997,10460,Utilities,Environmental Services
CXAI,CXApp Inc. Class A Common Stock,$2.71,0.34,14.346%,41339394.00,United States,2021,1793586,Technology,EDP Services
CXAIW,CXApp Inc. Warrant,$0.19,0.0204,12.028%,2898334.00,United States,2021,5512,Technology,EDP Services
CXDO,Crexendo Inc. Common Stock,$5.4601,0.0801,1.489%,142151541.00,United States,,11363,Telecommunications,Telecommunications Equipment
CYBR,CyberArk Software Ltd. Ordinary Shares,$262.12,2.22,0.854%,10754783600.00,Israel,2014,28614,Technology,Computer Software: Prepackaged Software
CYCC,Cyclacel Pharmaceuticals Inc. Common Stock,$2.65,-0.03,-1.119%,2233566.00,United States,,2245,Health Care,Biotechnology: Pharmaceutical Preparations
CYCCP,Cyclacel Pharmaceuticals Inc. 6% Convertible Preferred Stock,$18.50,0.00,0.00%,15592818.00,United States,,2,Health Care,Biotechnology: Pharmaceutical Preparations
CYCN,Cyclerion Therapeutics Inc. Common Stock,$3.11,0.00,0.00%,7604249.00,United States,,6,Health Care,Biotechnology: Pharmaceutical Preparations
CYN,Cyngn Inc. Common Stock,$0.19,0.0074,4.053%,7942559.00,United States,2021,673041,Technology,EDP Services
CYRX,CryoPort Inc. Common Stock,$16.925,0.405,2.452%,828710910.00,United States,,9347,Health Care,Biotechnology: Pharmaceutical Preparations
CYT,Cyteir Therapeutics Inc. Common Stock,$3.125,0.025,0.806%,112493963.00,United States,2021,1783,Health Care,Biotechnology: Pharmaceutical Preparations
CYTH,Cyclo Therapeutics Inc. Common Stock,$1.64,-0.01,-0.606%,37281139.00,United States,,3019,Health Care,Biotechnology: Pharmaceutical Preparations
CYTHW,Cyclo Therapeutics Inc. Warrant,$0.309,-0.0009,-0.29%,7024312.00,United States,,200,Health Care,Biotechnology: Pharmaceutical Preparations
CYTK,Cytokinetics Incorporated Common Stock,$73.63,0.54,0.739%,7219690029.00,United States,2004,149508,Health Care,Biotechnology: Pharmaceutical Preparations
CYTO,Altamira Therapeutics Ltd. Common Shares,$1.80,0.00,0.00%,629100.00,Bermuda,2014,945,Health Care,Biotechnology: Pharmaceutical Preparations
CZFS,Citizens Financial Services Inc. Common Stock,$45.56,0.00,0.00%,214410417.00,United States,,157,Finance,Major Banks
CZNC,Citizens & Northern Corp Common Stock,$18.76,0.46,2.514%,286554610.00,United States,,559,Finance,Major Banks
CZR,Caesars Entertainment Inc. Common Stock,$42.43,0.99,2.389%,9177599156.00,United States,,212767,Consumer Discretionary,Hotels/Resorts
CZWI,Citizens Community Bancorp Inc. Common Stock,$12.00,0.38,3.27%,125617092.00,United States,2006,724,Finance,Savings Institutions
DADA,Dada Nexus Limited American Depositary Shares,$2.205,0.065,3.037%,563335188.00,China,2020,223148,Technology,Computer Software: Programming Data Processing
DAIO,Data I/O Corporation Common Stock,$3.5959,0.0959,2.74%,32437888.00,United States,1981,3645,Industrials,Electrical Products
DAKT,Daktronics Inc. Common Stock,$9.26,0.46,5.227%,427628337.00,United States,1994,74973,Industrials,Office Equipment/Supplies/Services
DALN,DallasNews Corporation Series A Common Stock,$4.06,-0.02,-0.49%,21731109.00,United States,,8056,Consumer Discretionary,Newspapers/Magazines
DARE,Dare Bioscience Inc. Common Stock,$0.5198,0.016,3.176%,51232706.00,United States,2014,39650,Health Care,Biotechnology: Pharmaceutical Preparations
DASH,DoorDash Inc. Class A Common Stock,$123.835,1.395,1.139%,50029861469.00,United States,,255379,Industrials,Industrial Machinery/Components
DATS,DatChat Inc. Common Stock,$1.525,-0.025,-1.613%,3207565.00,United States,2021,118898,Technology,Computer Software: Prepackaged Software
DATSW,DatChat Inc. Series A Warrant,$0.0405,0.00,0.00%,85185.00,United States,2021,34,Technology,Computer Software: Prepackaged Software
DAVE,Dave Inc. Class A Common Stock,$26.725,0.545,2.082%,323409113.00,United States,,10027,Technology,Retail: Computer Software & Peripheral Equipment
DAVEW,Dave Inc. Warrants,$0.0345,-0.0001,-0.289%,417497.00,United States,,3461,Technology,Retail: Computer Software & Peripheral Equipment
DAWN,Day One Biopharmaceuticals Inc. Common Stock,$16.89,0.06,0.357%,1475930218.00,United States,2021,31410,Health Care,Biotechnology: Pharmaceutical Preparations
DBGI,Digital Brands Group Inc. Common Stock,$4.1001,-0.1199,-2.841%,3517308.00,United States,2021,11046,Consumer Discretionary,Clothing/Shoe/Accessory Stores
DBGIW,Digital Brands Group Inc. Warrant,$9.95,0.00,0.00%,8535697.00,United States,2021,4,Consumer Discretionary,Clothing/Shoe/Accessory Stores
DBVT,DBV Technologies S.A. American Depositary Shares,$0.8072,0.0035,0.435%,155448240.00,France,2014,40960,Health Care,Biotechnology: Pharmaceutical Preparations
DBX,Dropbox Inc. Class A Common Stock,$23.63,-0.22,-0.922%,8128345654.00,United States,2018,554343,Technology,Computer Software: Prepackaged Software
DCBO,Docebo Inc. Common Shares,$54.10,0.26,0.483%,1715907986.00,Canada,,4030,Technology,Computer Software: Prepackaged Software
DCFC,Tritium DCFC Limited Ordinary Shares,$0.1454,0.0024,1.678%,23269327.00,Australia,,394720,Technology,Electronic Components
DCFCW,Tritium DCFC Limited Warrant,$0.0556,-0.0112,-16.766%,8898037.00,Australia,,2086,Technology,Electronic Components
DCGO,DocGo Inc. Common Stock,$4.3499,0.4099,10.404%,451938642.00,United States,2020,697686,Health Care,Managed Health Care
DCOM,Dime Community Bancshares Inc. Common Stock,$18.94,0.55,2.991%,735383020.00,United States,,7741,Finance,Major Banks
DCOMP,Dime Community Bancshares Inc. Fixed-Rate Non-Cumulative Perpetual Preferred Stock Series A,$16.5914,0.4614,2.861%,644193973.00,United States,,1329,Finance,Major Banks
DCPH,Deciphera Pharmaceuticals Inc. Common Stock,$16.85,0.04,0.238%,1361481045.00,United States,2017,17822,Health Care,Biotechnology: Pharmaceutical Preparations
DCTH,Delcath Systems Inc. Common Stock,$4.195,0.035,0.841%,92483394.00,United States,,11242,Health Care,Medical/Dental Instruments
DDI,DoubleDown Interactive Co. Ltd. American Depository Shares,$12.62,0.02,0.159%,625364413.00,South Korea,2021,289,Technology,EDP Services
DDOG,Datadog Inc. Class A Common Stock,$131.08,0.61,0.468%,43502057946.00,United States,2019,978797,Technology,EDP Services
DECA,Denali Capital Acquisition Corp. Class A Ordinary Shares,$5.63,0.48,9.32%,0.00,United States,2022,4132,Finance,Blank Checks
DENN,Denny's Corporation Common Stock,$9.31,0.09,0.976%,486482124.00,United States,,18241,Consumer Discretionary,Restaurants
DERM,Journey Medical Corporation Common Stock,$3.70,0.05,1.37%,68481261.00,United States,2021,11736,Health Care,Biotechnology: Pharmaceutical Preparations
DFLI,Dragonfly Energy Holdings Corp. Common Stock (NV),$0.5802,0.0202,3.607%,34551381.00,United States,2021,45063,Technology,Electronic Components
DFLIW,Dragonfly Energy Holdings Corp. Warrant,$0.04,0.00,0.00%,2382032.00,United States,2021,1,Technology,Electronic Components
DGHI,Digihost Technology Inc. Common Subordinate Voting Shares,$1.6501,-0.0899,-5.167%,47652809.00,Canada,,43634,,
DGICA,Donegal Group Inc. Class A Common Stock,$13.90,0.04,0.289%,462114229.00,United States,,1122,Finance,Property-Casualty Insurers
DGICB,Donegal Group Inc. Class B Common Stock,$14.21,0.00,0.00%,472420374.00,United States,1986,2,Finance,Property-Casualty Insurers
DGII,Digi International Inc. Common Stock,$29.75,0.60,2.058%,1078634207.00,United States,1989,7683,Technology,Computer peripheral equipment
DGLY,Digital Ally Inc. Common Stock,$2.05,0.06,3.015%,5741542.00,United States,,2508,Technology,Radio And Television Broadcasting And Communications Equipment
DH,Definitive Healthcare Corp. Class A Common Stock,$9.50,0.30,3.261%,1105116846.00,United States,2021,137147,Technology,Computer Software: Prepackaged Software
DHAC,Digital Health Acquisition Corp. Common Stock,$11.78,0.00,0.00%,42454719.00,United States,2021,401,Health Care,Medical/Nursing Services
DHACW,Digital Health Acquisition Corp. Warrant,$0.0898,-0.0071,-7.327%,323636.00,United States,2021,61419,Health Care,Medical/Nursing Services
DHAI,DIH Holdings US Inc. Class A Common Stock,$0.80,0.004,0.503%,8768234.00,United States,2024,20643,,
DHAIW,DIH Holding US Inc. Warrants,$0.0153,0.0002,1.325%,167692.00,United States,2024,270491,Finance,Blank Checks
DHC,Diversified Healthcare Trust Common Shares of Beneficial Interest,$3.41,0.07,2.096%,819826618.00,United States,,68816,Real Estate,Real Estate Investment Trusts
DHCA,DHC Acquisition Corp. Class A ordinary share,$10.31,-0.50,-4.625%,0.00,United States,2021,1690,Finance,Blank Checks
DHCAU,DHC Acquisition Corp. Unit,$10.50,0.00,0.00%,0.00,United States,2021,1,Finance,Blank Checks
DHCAW,DHC Acquisition Corp. Warrant,$0.089,0.016,21.918%,0.00,United States,2021,7301,Finance,Blank Checks
DHCNI,Diversified Healthcare Trust 5.625% Senior Notes due 2042,$14.96,0.23,1.561%,3596658710.00,United States,,5104,Real Estate,Real Estate Investment Trusts
DHCNL,Diversified Healthcare Trust 6.25% Senior Notes Due 2046,$15.452,-0.028,-0.181%,3714944545.00,United States,,917,Real Estate,Real Estate Investment Trusts
DHIL,Diamond Hill Investment Group Inc. Class A Common Stock,$150.77,3.55,2.411%,433981343.00,United States,,1066,Finance,Investment Managers
DIBS,1stdibs.com Inc. Common Stock,$4.895,-0.095,-1.904%,195708209.00,United States,2021,7205,Consumer Discretionary,Catalog/Specialty Distribution
DIOD,Diodes Incorporated Common Stock,$68.695,1.255,1.861%,3155834836.00,United States,,10952,Technology,Semiconductors
DIST,Distoken Acquisition Corporation Ordinary Shares,$10.65,0.0099,0.093%,0.00,China,2023,1719,Finance,Blank Checks
DISTR,Distoken Acquisition Corporation Right,$0.082,0.00,0.00%,0.00,China,2023,282,Finance,Blank Checks
DISTW,Distoken Acquisition Corporation Warrant,$0.0166,0.0041,32.80%,0.00,China,2023,160690,Finance,Blank Checks
DJCO,Daily Journal Corp. (S.C.) Common Stock,$339.97,4.56,1.36%,468147529.00,United States,,1349,Consumer Discretionary,Newspapers/Magazines
DKNG,DraftKings Inc. Class A Common Stock,$43.07,0.74,1.748%,37325903941.00,United States,2019,1317805,Consumer Discretionary,Services-Misc. Amusement & Recreation
DLHC,DLH Holdings Corp.,$15.33,0.02,0.131%,218156754.00,United States,,2425,Consumer Discretionary,Professional Services
DLO,DLocal Limited Class A Common Shares,$16.96,0.34,2.046%,2749385600.00,Uruguay,2021,49197,Consumer Discretionary,Business Services
DLPN,Dolphin Entertainment Inc. Common Stock,$1.2958,-0.0742,-5.416%,23507554.00,United States,,3185,Consumer Discretionary,Other Consumer Services
DLTH,Duluth Holdings Inc. Class B Common Stock,$4.8485,0.0485,1.01%,167153303.00,United States,2015,5150,Consumer Discretionary,Clothing/Shoe/Accessory Stores
DLTR,Dollar Tree Inc. Common Stock,$146.62,0.48,0.328%,31944383403.00,United States,1995,101979,Consumer Discretionary,Department/Specialty Retail Stores
DMAC,DiaMedica Therapeutics Inc. Common Stock,$3.03,0.00,0.00%,114999744.00,United States,2018,524,Health Care,Biotechnology: Pharmaceutical Preparations
DMLP,Dorchester Minerals L.P. Common Units Representing Limited Partnership Interests,$30.57,0.03,0.098%,1210059739.00,United States,,4156,Energy,Oil & Gas Production
DMRC,Digimarc Corporation Common Stock,$38.125,-1.845,-4.616%,776143794.00,United States,,65110,Technology,EDP Services
DMTK,DermTech Inc. Common Stock,$1.36,0.03,2.256%,46570510.00,United States,2017,51757,Health Care,Medical Specialities
DNLI,Denali Therapeutics Inc. Common Stock,$20.56,0.35,1.732%,2841327195.00,United States,2017,75858,Health Care,Biotechnology: Biological Products (No Diagnostic Substances)
DNTH,Dianthus Therapeutics Inc. Common Stock,$24.91,0.81,3.361%,369110451.00,United States,2018,6649,Health Care,Biotechnology: Pharmaceutical Preparations
DNUT,Krispy Kreme Inc. Common Stock,$12.99,0.21,1.643%,2191413000.00,United States,2021,169900,Consumer Staples,Food Chains
DOCU,DocuSign Inc. Common Stock,$53.222,0.452,0.857%,10853769706.00,United States,2018,157401,Technology,EDP Services
DOGZ,Dogness (International) Corporation Class A Common Stock,$6.07,-0.30,-4.71%,64474101.00,China,2017,12355,Consumer Discretionary,Miscellaneous manufacturing industries
DOMH,Dominari Holdings Inc. Common Stock,$2.09,-0.0089,-0.424%,11171702.00,United States,,2722,Health Care,Biotechnology: Pharmaceutical Preparations
DOMO,Domo Inc. Class B Common Stock,$11.31,0.15,1.344%,414146164.00,United States,2018,18409,Technology,Computer Software: Prepackaged Software
DOOO,BRP Inc. (Recreational Products) Common Subordinate Voting Shares,$65.79,-0.58,-0.874%,4987317464.00,Canada,,9947,,
DORM,Dorman Products Inc. Common Stock,$95.21,2.30,2.476%,2997983429.00,United States,,3090,Consumer Discretionary,Auto Parts:O.E.M.
DOX,Amdocs Limited Ordinary Shares,$91.225,0.155,0.17%,10705054788.00,Guernsey,,20608,Technology,EDP Services
DOYU,DouYu International Holdings Limited ADS,$0.7583,-0.0082,-1.07%,242486634.00,China,2019,33373,Technology,Computer Software: Programming Data Processing
DPCS,DP Cap Acquisition Corp I Class A Ordinary Shares,$10.96,0.00,0.00%,0.00,United States,2021,1,Finance,Blank Checks
DPRO,Draganfly Inc. Common Shares,$0.1682,0.0023,1.386%,8182971.00,Canada,,139338,Consumer Discretionary,Electronic Components
DRCT,Direct Digital Holdings Inc. Class A Common Stock,$24.10,2.62,12.197%,343917243.00,United States,2022,41492,Technology,Computer Software: Programming Data Processing
DRIO,DarioHealth Corp. Common Stock,$2.03,-0.18,-8.145%,55245780.00,Israel,,104285,Health Care,Medical/Dental Instruments
