Symbol,Name,Last Sale,Net Change,% Change,Market Cap,Country,IPO Year,Volume,Sector,Industry
PZZA,Papa John's International Inc. Common Stock,$75.845,5.695,8.118%,2484368050.00,United States,1993,473079,Consumer Discretionary,Restaurants
QCOM,QUALCOMM Incorporated Common Stock,$157.462,1.612,1.034%,175727592000.00,United States,1991,867244,Technology,Computer peripheral equipment
QCRH,QCR Holdings Inc. Common Stock,$57.80,1.55,2.756%,967131795.00,United States,,2048,Finance,Major Banks
QDEL,QuidelOrtho Corporation Common Stock,$45.77,0.67,1.486%,3058292723.00,United States,,30059,Health Care,Medical Specialities
QDRO,Quadro Acquisition One Corp. Class A Ordinary Shares,$10.93,-0.06,-0.546%,0.00,United States,2021,800,Finance,Blank Checks
QDROW,Quadro Acquisition One Corp.  Warrant,$0.06,0.00,0.00%,0.00,United States,2021,25,Finance,Blank Checks
QETA,Quetta Acquisition Corporation Common Stock,$10.18,0.00,0.00%,0.00,United States,2023,15834,,
QETAR,Quetta Acquisition Corporation Right,$1.02,0.01,0.99%,0.00,United States,2023,2000,,
QETAU,Quetta Acquisition Corporation Unit,$10.29,0.00,0.00%,0.00,United States,2023,104,,
QFIN,Qifu Technology Inc. American Depositary Shares,$15.86,0.36,2.323%,2559741068.00,China,2018,54208,Finance,Finance: Consumer Services
QH,Quhuo Limited American Depository Shares,$1.235,0.065,5.556%,7617012.00,China,2020,1110,Consumer Discretionary,Business Services
QIPT,Quipt Home Medical Corp. Common Shares,$4.285,0.035,0.824%,180409088.00,United States,,2806,,
QLGN,Qualigen Therapeutics Inc. Common Stock,$0.4599,-0.0101,-2.149%,2382769.00,United States,2015,14999,Health Care,Biotechnology: Pharmaceutical Preparations
QLI,Qilian International Holding Group Ltd. Ordinary Shares,$0.3749,-0.0351,-8.561%,13402675.00,China,2021,20796,Health Care,Biotechnology: Pharmaceutical Preparations
QLYS,Qualys Inc. Common Stock,$171.48,4.16,2.486%,6340860373.00,United States,2012,30261,Technology,EDP Services
QMCO,Quantum Corporation Common Stock,$0.5198,0.0298,6.082%,49402108.00,United States,,29601,Technology,Electronic Components
QNCX,Quince Therapeutics Inc. Common Stock,$1.37,0.03,2.239%,58730457.00,United States,2019,9339,Health Care,Biotechnology: Biological Products (No Diagnostic Substances)
QNRX,Quoin Pharmaceuticals Ltd. American Depositary Shares,$2.7753,0.1653,6.333%,2739832.00,Israel,2016,2369,Health Care,Medical/Dental Instruments
QNST,QuinStreet Inc. Common Stock,$14.56,0.01,0.069%,799205753.00,United States,2010,16989,Consumer Discretionary,Advertising
QOMO,Qomolangma Acquisition Corp. Common Stock,$10.89,0.00,0.00%,0.00,United States,2022,58,Finance,Blank Checks
QOMOW,Qomolangma Acquisition Corp. Warrant,$0.02,0.00,0.00%,0.00,United States,2022,101,Finance,Blank Checks
QQQX,Nuveen NASDAQ 100 Dynamic Overwrite Fund Shares of Beneficial Interest,$23.965,0.155,0.651%,0.00,United States,,7472,Finance,Finance Companies
QRHC,Quest Resource Holding Corporation Common Stock,$6.98,-0.01,-0.143%,140018430.00,United States,,269,Utilities,Environmental Services
QRTEA,Qurate Retail Inc. Series A Common Stock ,$1.565,0.085,5.743%,609406962.00,United States,,551181,Consumer Discretionary,Catalog/Specialty Distribution
QRTEB,Qurate Retail Inc. Series B Common Stock ,$5.60,0.00,0.00%,2180625552.00,United States,,49,Consumer Discretionary,Catalog/Specialty Distribution
QRTEP,Qurate Retail Inc. 8.0% Fixed Rate Cumulative Redeemable Preferred Stock,$50.45,0.74,1.489%,19645099839.00,United States,,13928,Consumer Discretionary,Catalog/Specialty Distribution
QRVO,Qorvo Inc. Common Stock,$113.69,1.64,1.464%,10976594190.00,United States,,62621,Technology,Semiconductors
QSG,QuantaSing Group Limited American Depositary Shares,$3.58,0.10,2.874%,197638024.00,China,2023,7435,Real Estate,Other Consumer Services
QSI,Quantum-Si Incorporated Class A Common Stock,$1.8099,0.0699,4.017%,256513569.00,United States,2020,96515,Health Care,Biotechnology: Pharmaceutical Preparations
QSIAW,Quantum-Si Incorporated Warrant,$0.2475,0.0565,29.581%,35077688.00,United States,2020,2435,Health Care,Biotechnology: Pharmaceutical Preparations
QTRX,Quanterix Corporation Common Stock,$23.83,0.35,1.491%,901482847.00,United States,2017,7999,Industrials,Biotechnology: Laboratory Analytical Instruments
QUBT,Quantum Computing Inc. Common Stock,$0.915,0.0717,8.502%,68713983.00,United States,,498474,Technology,Computer Manufacturing
QUIK,QuickLogic Corporation Common Stock,$15.68,0.01,0.064%,218110791.00,United States,1999,47154,Technology,Semiconductors
QURE,uniQure N.V. Ordinary Shares,$6.16,-0.53,-7.922%,294518711.00,Netherlands,2014,199256,Health Care,Biotechnology: Pharmaceutical Preparations
RAIL,FreightCar America Inc. Common Stock,$3.01,0.00,0.00%,53889345.00,United States,2005,2089,Industrials,Railroads
RAND,Rand Capital Corporation Common Stock,$13.78,0.03,0.218%,35566469.00,United States,,818,Finance,Finance: Consumer Services
RANI,Rani Therapeutics Holdings Inc. Class A Common Stock,$3.63,0.20,5.831%,181487324.00,United States,2021,2914,Health Care, Medicinal Chemicals and Botanical Products 
RAPT,RAPT Therapeutics Inc. Common Stock,$9.02,0.36,4.157%,310253832.00,United States,2019,129599,Health Care,Biotechnology: Pharmaceutical Preparations
RARE,Ultragenyx Pharmaceutical Inc. Common Stock,$53.44,0.69,1.308%,4400019113.00,United States,2014,56239,Health Care,Biotechnology: Pharmaceutical Preparations
RAVE,Rave Restaurant Group Inc. Common Stock,$1.85,0.00,0.00%,26985147.00,United States,,400,Consumer Discretionary,Food Distributors
RAYA,Erayak Power Solution Group Inc. Class A Ordinary Shares,$0.7869,0.0069,0.885%,9796905.00,China,2022,948,Consumer Discretionary,Metal Fabrications
RBB,RBB Bancorp Common Stock,$17.35,0.64,3.83%,329568507.00,United States,2017,4858,Finance,Major Banks
RBBN,Ribbon Communications Inc. Common Stock,$3.00,0.08,2.74%,515192271.00,United States,,89182,Technology,EDP Services
RBCAA,Republic Bancorp Inc. Class A Common Stock,$49.29,0.83,1.713%,955171933.00,United States,1998,488,Finance,Major Banks
RBKB,Rhinebeck Bancorp Inc. Common Stock,$8.50,0.00,0.00%,94117160.00,United States,2019,7,Finance,Major Banks
RCAC,Revelstone Capital Acquisition Corp. Class A Common Stock,$10.6501,0.00,0.00%,0.00,United States,2022,134,Finance,Blank Checks
RCACW,Revelstone Capital Acquisition Corp. Warrant,$0.002,0.00,0.00%,0.00,United States,2022,71,Finance,Blank Checks
RCAT,Red Cat Holdings Inc. Common Stock,$0.74,0.00,0.00%,54880365.00,United States,,11372,Industrials,Wholesale Distributors
RCEL,Avita Medical Inc. Common Stock,$17.2386,0.3686,2.185%,443146864.00,United States,,15296,Health Care,Medical/Dental Instruments
RCKT,Rocket Pharmaceuticals Inc. Common Stock,$29.57,0.54,1.86%,2676210613.00,United States,2015,20604,Health Care,Biotechnology: Pharmaceutical Preparations
RCKTW,Rocket Pharmaceuticals Inc. Warrant,$0.26,-0.01,-3.704%,,United States,,6381,Health Care,Biotechnology: Pharmaceutical Preparations
RCKY,Rocky Brands Inc. Common Stock,$28.92,-0.90,-3.018%,213366815.00,United States,1993,10288,Consumer Discretionary,Shoe Manufacturing
RCM,R1 RCM Inc. Common Stock,$14.275,-0.115,-0.799%,5999500340.00,United States,,461516,Consumer Discretionary,Other Consumer Services
RCMT,RCM Technologies Inc. Common Stock,$27.87,0.21,0.759%,218288793.00,United States,,9179,Consumer Discretionary,Professional Services
RCON,Recon Technology Ltd. Class A Ordinary Shares,$0.1676,0.00,0.00%,6792529.00,China,2009,4800,Energy,Oilfield Services/Equipment
RCRT,Recruiter.com Group Inc. Common Stock,$2.065,0.125,6.443%,2961010.00,United States,,771,Technology,EDP Services
RCRTW,Recruiter.com Group Inc. Warrant,$0.0112,0.0005,4.673%,16060.00,United States,,27798,Technology,EDP Services
RDCM,Radcom Ltd. Ordinary Shares,$9.95,0.04,0.404%,149150500.00,Israel,1997,1927,Technology,Computer peripheral equipment
RDFN,Redfin Corporation Common Stock,$7.43,0.43,6.143%,885964538.00,United States,2017,954405,Finance,Real Estate
RDHL,Redhill Biopharma Ltd. American Depositary Shares,$0.5689,0.029,5.371%,16898052.00,Israel,,84449,Health Care,Biotechnology: Pharmaceutical Preparations
RDI,Reading International Inc Class A Common Stock,$1.8646,0.0746,4.168%,38397398.00,United States,,1347,Consumer Discretionary,Movies/Entertainment
RDIB,Reading International Inc Class B Common Stock,$15.12,0.00,0.00%,25410521.00,United States,,9,Consumer Discretionary,Movies/Entertainment
RDNT,RadNet Inc. Common Stock,$37.27,-0.26,-0.693%,2530435655.00,United States,,23283,Health Care,Medical Specialities
RDUS,Radius Recycling Inc. Class A Common Stock,$20.33,-0.26,-1.263%,566428056.00,United States,,13800,Consumer Discretionary,Industrial Specialties
RDVT,Red Violet Inc. Common Stock ,$18.09,0.26,1.458%,252163836.00,United States,,363,Technology,Computer Software: Prepackaged Software
RDWR,Radware Ltd. Ordinary Shares,$17.795,0.195,1.108%,779775121.00,Israel,1999,8071,Consumer Discretionary,Business Services
RDZN,Roadzen Inc. Ordinary Shares,$6.26,-0.24,-3.692%,428439590.00,United States,2022,262,Finance,Blank Checks
RDZNW,Roadzen Inc. Warrants,$0.1329,0.013,10.842%,9095786.00,United States,2022,21523,Finance,Blank Checks
REAL,The RealReal Inc. Common Stock,$1.78,0.07,4.094%,183968546.00,United States,2019,226347,Consumer Discretionary,Other Specialty Stores
REAX,The Real Brokerage Inc. Common Shares,$2.9408,0.0108,0.369%,534637440.00,Canada,,10254,Finance,Real Estate
REBN,Reborn Coffee Inc. Common Stock,$1.55,0.03,1.974%,4184315.00,United States,2022,1974,Consumer Discretionary,Restaurants
REE,REE Automotive Ltd. Class A Ordinary Shares,$8.1664,0.3864,4.967%,91128735.00,Israel,,8963,Consumer Discretionary,Auto Manufacturing
REFI,Chicago Atlantic Real Estate Finance Inc. Common Stock,$16.19,0.11,0.684%,294370482.00,United States,2021,5318,Real Estate,Real Estate Investment Trusts
REFR,Research Frontiers Incorporated Common Stock,$1.00,0.00,0.00%,33509287.00,United States,,896,Technology,Industrial Machinery/Components
REG,Regency Centers Corporation Common Stock,$61.41,0.44,0.722%,11334969001.00,United States,1993,35117,Real Estate,Real Estate Investment Trusts
REGCO,Regency Centers Corporation 5.875% Series B Cumulative Redeemable Preferred Stock,$23.59,0.00,0.00%,4354208089.00,United States,,46,,
REGCP,Regency Centers Corporation 6.25% Series A Cumulative Redeemable Preferred Stock,$24.15,0.00,0.00%,4457572079.00,United States,,4,,
REGN,Regeneron Pharmaceuticals Inc. Common Stock,$978.20,-9.41,-0.953%,107369086667.00,United States,1991,51449,Health Care,Biotechnology: Pharmaceutical Preparations
REKR,Rekor Systems Inc. Common Stock,$2.34,0.09,4.00%,161804198.00,United States,,75579,Telecommunications,Telecommunications Equipment
RELI,Reliance Global Group Inc. Common Stock,$0.4746,0.0226,5.00%,2263302.00,United States,,32143,Finance,Specialty Insurers
RELIW,Reliance Global Group Inc. Series A Warrants,$0.08,0.04,100.00%,381509.00,United States,,400,Finance,Specialty Insurers
RELL,Richardson Electronics Ltd. Common Stock,$8.92,0.24,2.765%,127363694.00,United States,1983,4441,Technology,Electronic Components
RELY,Remitly Global Inc. Common Stock,$20.76,-0.15,-0.717%,3913367391.00,United States,2021,117818,Technology,Computer Software: Prepackaged Software
RENB,Renovaro Inc. Common Stock,$2.30,0.09,4.072%,330437256.00,United States,,30456,Health Care,Biotechnology: Pharmaceutical Preparations
RENE,Cartesian Growth Corporation II Class A Ordinary Shares,$11.05,0.00,0.00%,0.00,United States,2022,3,Finance,Blank Checks
RENEW,Cartesian Growth Corporation II Warrant,$0.1497,-0.0402,-21.169%,0.00,United States,2022,940,Finance,Blank Checks
RENT,Rent the Runway Inc. Class A Common Stock,$0.406,-0.0044,-1.072%,28789711.00,United States,2021,57893,Consumer Discretionary,Other Specialty Stores
REPL,Replimune Group Inc. Common Stock,$8.73,0.02,0.23%,535915372.00,United States,2018,39146,Health Care,Biotechnology: Pharmaceutical Preparations
RETO,ReTo Eco-Solutions Inc. Common Shares,$0.3421,-0.0169,-4.708%,1840498.00,China,2017,47587,Consumer Discretionary,Multi-Sector Companies
REVB,Revelation Biosciences Inc. Common Stock,$3.8477,-0.2723,-6.609%,807675.00,United States,2020,151304,Health Care,Biotechnology: Pharmaceutical Preparations
REVBW,Revelation Biosciences Inc. Warrant,$0.014,0.0019,15.702%,2939.00,United States,2020,34414,Health Care,Biotechnology: Pharmaceutical Preparations
REYN,Reynolds Consumer Products Inc. Common Stock,$29.61,0.08,0.271%,6218380140.00,United States,2020,28754,Consumer Discretionary,Containers/Packaging
RFACW,RF Acquisition Corp. Warrants,$0.0142,0.00,0.00%,0.00,Singapore,2022,100,Finance,Blank Checks
RFIL,RF Industries Ltd. Common Stock,$3.28,0.02,0.613%,33925771.00,United States,,108,Technology,Electrical Products
RGC,Regencell Bioscience Holdings Limited Ordinary Shares,$7.00,-0.06,-0.85%,91090062.00,Hong Kong,2021,1019,Health Care, Medicinal Chemicals and Botanical Products 
RGCO,RGC Resources Inc. Common Stock,$19.13,0.30,1.593%,194425746.00,United States,,640,Utilities,Oil & Gas Production
RGEN,Repligen Corporation Common Stock,$196.60,0.66,0.337%,10964593345.00,United States,1986,26693,Health Care,Biotechnology: Biological Products (No Diagnostic Substances)
RGF,The Real Good Food Company Inc. Class A Common Stock,$1.20,-0.01,-0.826%,40421045.00,United States,2021,18987,Consumer Staples,Packaged Foods
RGLD,Royal Gold Inc. Common Stock,$102.34,1.04,1.027%,6722961444.00,United States,,50732,Industrials,Precious Metals
RGLS,Regulus Therapeutics Inc. Common Stock,$1.51,0.02,1.342%,30536235.00,United States,2012,1619,Health Care,Biotechnology: Pharmaceutical Preparations
RGNX,REGENXBIO Inc. Common Stock,$19.71,-0.19,-0.955%,875667109.00,United States,2015,46911,Health Care,Biotechnology: Biological Products (No Diagnostic Substances)
RGP,Resources Connection Inc. Common Stock,$13.855,0.245,1.80%,464256180.00,United States,,5823,Consumer Discretionary,Business Services
RGS,Regis Corporation Common Stock,$8.35,0.00,0.00%,19033408.00,United States,1991,113,Consumer Discretionary,Other Consumer Services
RGTI,Rigetti Computing Inc. Common Stock,$2.05,0.04,1.99%,300625393.00,United States,,2889910,Technology,Retail: Computer Software & Peripheral Equipment
RGTIW,Rigetti Computing Inc. Warrants,$0.34,0.0009,0.265%,49859821.00,United States,,2300,Technology,Retail: Computer Software & Peripheral Equipment
RICK,RCI Hospitality Holdings Inc. Common Stock,$57.58,0.93,1.642%,538930662.00,United States,1995,869,Consumer Discretionary,Restaurants
RIGL,Rigel Pharmaceuticals Inc. Common Stock,$1.56,0.01,0.645%,272016425.00,United States,2000,97806,Health Care,Biotechnology: Pharmaceutical Preparations
RILY,B. Riley Financial Inc. Common Stock,$18.96,-0.09,-0.472%,579851234.00,United States,,162322,Finance,Investment Managers
RILYG,B. Riley Financial Inc. 5.00% Senior Notes due 2026,$15.87,0.22,1.406%,485350163.00,United States,,320,Finance,Investment Managers
RILYK,B. Riley Financial Inc. 5.50% Senior Notes Due 2026,$18.59,0.79,4.438%,568535572.00,United States,,3100,Finance,Investment Managers
RILYL,B. Riley Financial Inc. Depositary Shares each representing 1/1000th in a share of 7.375% Series B Cumulative Perpetual Preferred Stock par value $0.0001,$19.8499,1.6162,8.864%,607066931.00,United States,,1397,Finance,Investment Managers
RILYM,B. Riley Financial Inc. 6.375% Senior Notes due 2025,$20.97,0.21,1.012%,641322805.00,United States,,1194,Finance,Investment Managers
RILYN,B. Riley Financial Inc. 6.50% Senior Notes Due 2026,$16.20,0.17,1.061%,495442510.00,United States,,1517,Finance,Investment Managers
RILYO,B. Riley Financial Inc. 6.75% Senior Notes due 2024,$25.05,-0.07,-0.279%,766100919.00,United States,,3214,Finance,Investment Managers
RILYP,B. Riley Financial Inc. Depositary Shares each representing a 1/1000th fractional interest in a share of Series A Cumulative Perpetual Preferred Stock,$15.62,0.00,0.00%,477704445.00,United States,,53,Finance,Investment Managers
RILYT,B. Riley Financial Inc. 6.00% Senior Notes Due 2028,$14.42,0.28,1.98%,441005000.00,United States,,706,Finance,Investment Managers
RILYZ,B. Riley Financial Inc. 5.25% Senior Notes due 2028,$13.41,0.08,0.60%,410116300.00,United States,,8300,Finance,Investment Managers
RIOT,Riot Platforms Inc. Common Stock ,$14.53,-1.12,-7.157%,3683910235.00,United States,,8682112,Finance,Finance: Consumer Services
RIVN,Rivian Automotive Inc. Class A Common Stock,$11.655,0.355,3.142%,11392175216.00,United States,2021,7730568,Consumer Discretionary,Auto Manufacturing
RKDA,Arcadia Biosciences Inc. Common Stock,$2.87,0.00,0.00%,3186667.00,United States,2015,73,Industrials,Agricultural Chemicals
RKLB,Rocket Lab USA Inc. Common Stock,$4.72,0.13,2.832%,2293386607.00,United States,2020,1050763,Industrials,Aerospace
RLAY,Relay Therapeutics Inc. Common Stock,$10.31,0.23,2.282%,1352455841.00,United States,2020,38311,Health Care,Biotechnology: Biological Products (No Diagnostic Substances)
RLMD,Relmada Therapeutics Inc. Common Stock,$6.20,0.06,0.977%,186615059.00,United States,,15580,Health Care,Biotechnology: Pharmaceutical Preparations
RLYB,Rallybio Corporation Common Stock,$2.30,0.08,3.604%,86925522.00,United States,2021,22654,Health Care,Biotechnology: Pharmaceutical Preparations
RMBI,Richmond Mutual Bancorporation Inc. Common Stock,$11.41,0.00,0.00%,128301673.00,United States,2019,5,Finance,Major Banks
RMBL,RumbleOn Inc. Class B Common Stock,$7.71,0.19,2.527%,129985195.00,United States,,5049,Technology,EDP Services
RMBS,Rambus Inc. Common Stock,$58.01,1.15,2.023%,6258559850.00,United States,1997,67730,Technology,Semiconductors
RMCF,Rocky Mountain Chocolate Factory Inc. Common Stock,$4.0492,0.0492,1.23%,25571747.00,United States,,1712,Consumer Staples,Specialty Foods
RMCO,Royalty Management Holding Corporation Class A Common Stock,$1.2961,-0.0739,-5.394%,0.00,United States,2023,4864967,Miscellaneous,Multi-Sector Companies
RMCOW,Royalty Management Holding Corporation Warrant,$0.0975,0.0625,178.571%,0.00,United States,2023,28197,Miscellaneous,Multi-Sector Companies
RMGC,RMG Acquisition Corp. III Class A Ordinary Shares,$10.00,0.00,0.00%,0.00,United States,2021,170,Finance,Blank Checks
RMGCU,RMG Acquisition Corp. III Unit,$9.75,-0.20,-2.01%,0.00,United States,2021,100,Finance,Blank Checks
RMNI,Rimini Street Inc. (DE) Common Stock,$3.31,0.21,6.774%,295877590.00,United States,2015,45820,Consumer Discretionary,Business Services
RMR,The RMR Group Inc. Class A Common Stock,$24.38,0.15,0.619%,773058667.00,United States,,12894,Consumer Discretionary,Professional Services
RMTI,Rockwell Medical Inc. Common Stock,$1.35,-0.01,-0.735%,38461045.00,United States,1998,13290,Health Care,Biotechnology: Pharmaceutical Preparations
RNA,Avidity Biosciences Inc. Common Stock,$18.255,2.995,19.626%,1352718392.00,United States,2020,931003,Health Care,Biotechnology: Pharmaceutical Preparations
RNAC,Cartesian Therapeutics Inc. Common Stock,$0.765,0.045,6.25%,123874783.00,United States,2016,18319,Health Care,Biotechnology: Pharmaceutical Preparations
RNAZ,TransCode Therapeutics Inc. Common Stock,$0.69,-0.0115,-1.639%,432934.00,United States,2021,28989,Health Care,Biotechnology: Pharmaceutical Preparations
RNLX,Renalytix plc American Depositary Shares,$0.9209,0.0909,10.952%,46012840.00,United Kingdom,2020,104121,Health Care,Medical Specialities
RNW,ReNew Energy Global plc Class A Ordinary Shares,$6.47,0.13,2.05%,520890771.00,United Kingdom,,112733,Industrials,Environmental Services
RNWWW,ReNew Energy Global plc Warrant,$0.54,0.01,1.887%,43474655.00,United Kingdom,,7912,Industrials,Environmental Services
RNXT,RenovoRx Inc. Common Stock,$1.63,0.03,1.875%,17430535.00,United States,2021,7447,Health Care,Biotechnology: Pharmaceutical Preparations
ROAD,Construction Partners Inc. Class A Common Stock,$48.115,0.325,0.68%,2541788715.00,United States,2018,14444,Industrials,Military/Government/Technical
ROCK,Gibraltar Industries Inc. Common Stock,$77.015,-0.195,-0.253%,2344564102.00,United States,1993,7105,Industrials,Steel/Iron Ore
ROCL,Roth CH Acquisition V Co. Common Stock,$10.79,-0.03,-0.277%,0.00,United States,2022,388,Finance,Blank Checks
ROCLW,Roth CH Acquisition V Co. Warrant,$0.0999,0.00,0.00%,0.00,United States,2022,1,Finance,Blank Checks
ROIC,Retail Opportunity Investments Corp. Common Stock (MD),$12.90,0.03,0.233%,1638362281.00,United States,,65172,Real Estate,Real Estate Investment Trusts
ROIV,Roivant Sciences Ltd. Common Shares,$11.725,0.015,0.128%,9448544420.00,United Kingdom,,108506,Health Care,Biotechnology: Pharmaceutical Preparations
ROKU,Roku Inc. Class A Common Stock,$64.42,0.71,1.114%,9245683117.00,United States,2017,622384,Telecommunications,Cable & Other Pay Television Services
ROMA,Roma Green Finance Limited Ordinary Shares,$1.20,-0.01,-0.826%,12510348.00,Hong Kong,2024,55077,Finance,Savings Institutions
ROOT,Root Inc. Class A Common Stock,$28.00,0.03,0.107%,408800000.00,United States,2020,187623,Finance,Property-Casualty Insurers
ROP,Roper Technologies Inc. Common Stock,$542.81,-0.64,-0.118%,58092792576.00,United States,1992,33525,Industrials,Industrial Machinery/Components
ROST,Ross Stores Inc. Common Stock,$149.50,-0.95,-0.631%,50331606767.00,United States,1985,113137,Consumer Discretionary,Clothing/Shoe/Accessory Stores
RPAY,Repay Holdings Corporation Class A Common Stock,$8.78,0.24,2.81%,831105844.00,United States,2018,25676,Consumer Discretionary,Business Services
RPD,Rapid7 Inc. Common Stock,$58.665,1.765,3.102%,3636401064.00,United States,2015,36197,Technology,Computer Software: Prepackaged Software
RPHM,Reneo Pharmaceuticals Inc. Common Stock,$1.64,0.02,1.235%,54631331.00,United States,2021,9000,Health Care,Biotechnology: Pharmaceutical Preparations
RPID,Rapid Micro Biosystems Inc. Class A Common Stock,$1.00,0.0005,0.05%,42398905.00,United States,2021,9297,Health Care,Medical Specialities
RPRX,Royalty Pharma plc Class A Ordinary Shares ,$30.42,-0.19,-0.621%,18173966342.00,United States,2020,92362,Health Care,Biotechnology: Pharmaceutical Preparations
RPTX,Repare Therapeutics Inc. Common Shares,$7.03,0.43,6.515%,296171447.00,Canada,2020,16860,Health Care,Biotechnology: Pharmaceutical Preparations
RR,Richtech Robotics Inc. Class B Common Stock,$1.7138,0.0439,2.629%,0.00,United States,2023,20463,,
RRBI,Red River Bancshares Inc. Common Stock,$49.94,0.75,1.525%,356160394.00,United States,2019,2317,Consumer Discretionary,Hotels/Resorts
RRGB,Red Robin Gourmet Burgers Inc. Common Stock,$7.54,-1.06,-12.326%,116719200.00,United States,2002,225566,Consumer Discretionary,Restaurants
RRR,Red Rock Resorts Inc. Class A Common Stock,$57.21,0.47,0.828%,6017813146.00,United States,2016,10171,Consumer Discretionary,Hotels/Resorts
RSLS,ReShape Lifesciences Inc. Common Stock,$0.1714,-0.0011,-0.638%,4020538.00,United States,2016,116785,Health Care,Medical/Dental Instruments
RSSS,Research Solutions Inc Common Stock,$3.125,-0.015,-0.478%,101939084.00,United States,,5568,Consumer Discretionary,Business Services
RSVR,Reservoir Media Inc. Common Stock,$7.15,0.05,0.704%,463479159.00,United States,2021,30253,Consumer Discretionary,Movies/Entertainment
RSVRW,Reservoir Media Inc. Warrant,$1.29,0.29,29.00%,83620715.00,United States,2021,401,Consumer Discretionary,Movies/Entertainment
RTC,Baijiayun Group Ltd. Class A Ordinary Shares,$0.84,0.0065,0.78%,79882969.00,China,2006,26656,Technology,Computer Software: Prepackaged Software
RUM,Rumble Inc. Class A Common Stock,$6.576,0.206,3.234%,2538698712.00,United States,2021,234953,Technology,Computer Software: Prepackaged Software
RUMBW,Rumble Inc. Warrant,$1.9099,0.0599,3.238%,737326744.00,United States,2021,400,Technology,Computer Software: Prepackaged Software
RUN,Sunrun Inc. Common Stock,$12.36,0.56,4.746%,2714133166.00,United States,2015,2410661,Miscellaneous,Industrial Machinery/Components
RUSHA,Rush Enterprises Inc. Common Stock Cl A,$48.27,0.42,0.878%,3759335419.00,United States,,5776,Consumer Discretionary,Retail-Auto Dealers and Gas Stations
RUSHB,Rush Enterprises Inc. Class B,$50.02,-0.21,-0.418%,3895627878.00,United States,,6440,Consumer Discretionary,Other Specialty Stores
RVMD,Revolution Medicines Inc. Common Stock,$30.34,0.38,1.268%,4996706979.00,United States,2020,50767,Health Care,Biotechnology: Biological Products (No Diagnostic Substances)
RVMDW,Revolution Medicines Inc. Warrant,$0.21,0.0047,2.289%,34584986.00,United States,,330,,
RVNC,Revance Therapeutics Inc. Common Stock,$6.584,0.924,16.325%,578163952.00,United States,2014,972712,Health Care,Biotechnology: Pharmaceutical Preparations
RVPH,Reviva Pharmaceuticals Holdings Inc. Common Stock ,$3.84,-0.03,-0.775%,86977021.00,United States,2020,10723,Health Care,Biotechnology: Pharmaceutical Preparations
RVPHW,Reviva Pharmaceuticals Holdings Inc. Warrants,$0.8397,0.0397,4.963%,19019428.00,United States,2018,225,Health Care,Biotechnology: Pharmaceutical Preparations
RVSB,Riverview Bancorp Inc Common Stock,$4.73,0.115,2.492%,99855233.00,United States,,356,Finance,Major Banks
RVSN,Rail Vision Ltd. Ordinary Share,$3.2595,0.3595,12.397%,9772887.00,Israel,2022,11493687,,
RVSNW,Rail Vision Ltd. Warrant,$0.1304,0.0253,24.072%,390975.00,Israel,2022,7709,,
RVYL,Ryvyl Inc. Common Stock,$4.14,0.04,0.976%,22298624.00,United States,,285,Technology,EDP Services
RWAY,Runway Growth Finance Corp. Common Stock,$13.47,0.05,0.373%,545659853.00,United States,2021,11230,,
RWAYL,Runway Growth Finance Corp. 7.50% Notes due 2027,$24.8833,0.00,0.00%,1008004293.00,United States,,5,,
RWAYZ,Runway Growth Finance Corp. 8.00% Notes due 2027,$25.09,-0.05,-0.199%,1016377559.00,United States,,3321,,
RWOD,Redwoods Acquisition Corp. Common Stock,$10.8901,0.00,0.00%,0.00,United States,2022,50,Finance,Blank Checks
RWODR,Redwoods Acquisition Corp. Rights,$0.0911,-0.0888,-49.361%,0.00,United States,2022,885,Finance,Blank Checks
RWODW,Redwoods Acquisition Corp. Warrants,$0.05,-0.0328,-39.614%,0.00,United States,2022,27861,Finance,Blank Checks
